,TITLE,SINGER,LYRIC
58,bad guy,Billie Eilish,White shirt now red my bloody nose Sleepin' you're on your tippy toes Creepin' around like no one knows Think you're so criminal Bruises on both my knees for you Don't say thank you or please I do what I want when I'm wanting to My soul so cynical So you're a tough guy Like it really rough guy Just can't get enough guy Chest always so puffed guy I'm that bad type Make your mama sad type Make your girlfriend mad tight Might seduce your dad type I'm the bad guy duh I'm the bad guy I like it when you take control Even if you know that you don't Own me I'll let you play the role I'll be your animal My mommy likes to sing along with me But she won't sing this song If she reads all the lyrics She'll pity the men I know So you're a tough guy Like it really rough guy Just can't get enough guy Chest always so puffed guy I'm that bad type Make your mama sad type Make your girlfriend mad tight Might seduce your dad type I'm the bad guy duh I'm the bad guy duh I'm only good at bein' bad bad I like when you get mad I guess I'm pretty glad that you're alone You said she's scared of me I mean I don't see what she sees But maybe it's 'cause I'm wearing your cologne I'm a bad guy I'm a bad guy Bad guy bad guy I'm a bad
59,At My Worst,Pink Sweat$,Can I call you baby Can you be my friend Can you be my lover up until the very end Let me show you love oh no pretend Stick by my side even when the world is caving in yeah Oh oh oh don't don't you worry I'll be there whenever you want me I need somebody who can love me at my worst Know I'm not perfect but I hope you see my worth 'Cause it's only you nobody new I put you first And for you girl I swear I'd do the worst Ooh ooh-ooh Ooh-ooh-ooh ooh-ooh-ooh-ooh If you stay forever let me hold your hand I can fill those places in your heart no one else can Let me show you love oh no pretend yeah I'll be right here baby you know it's sink or swim Oh oh oh don't don't you worry I'll be there whenever you want me I need somebody who can love me at my worst Know I'm not perfect but I hope you see my worth yeah 'Cause it's only you nobody new I put you first You first And for you girl I swear I'd do the worst Ooh ooh-ooh Ooh-ooh-ooh ooh-ooh-ooh-ooh Ooh-ooh-ooh ooh ooh-ooh Ooh-ooh-ooh ooh-ooh-ooh-ooh I need somebody who can love me at my worst Know I'm not perfect but I hope you see my worth 'Cause it's only you nobody new I put you first And for you girl I swear I'd do the worst
60,Christmas Tree Farm,Taylor Swift,My winter nights are taken up by static Stress and holiday shopping traffic But I close my eyes and I'm somewhere else Just like magic In my heart is a Christmas tree farm Where the people would come To dance under sparkling lights Bundled up in their mittens and coats And the cider would flow And I just wanna be there tonight Sweet dreams of holly and ribbon Mistakes are forgiven And everythin' is icy and blue And you would be there too Under the mistletoe Watchin' the fire glow And tellin' me I love you Just bein' in your arms Takes me back to that little farm Where every wish comes true In my heart is a Christmas tree farm There's a light in the barn We run inside out from the cold In the town kids are dreamin' of sleighs And they're warm and they're safe They wake to see a blanket of snow Sweet dreams of holly and ribbon Mistakes are forgiven And everythin' is icy and blue And you would be there too Under the mistletoe Watchin' the fire glow And tellin' me I love you Just bein' in your arms Takes me back to that little farm Where every wish comes true Baby yeah And when I'm feelin' alone You remind me of home Oh baby baby Merry Christmas And when the world isn't fair I pretend that we're there Baby baby Merry Christmas To you Under the mistletoe To you Watching the fire glow And tellin' me I love you Oh baby baby Merry Christmas Oh baby baby Merry Christmas Darling Oh baby baby Merry Christmas I love you Oh baby baby Merry Christmas Oh baby baby Merry Christmas I just want you to know Oh baby baby Merry Christmas Where every wish comes true I love you
61,Kiss Me More (Feat. SZA),Doja Cat,"We hug and yes, we make love And always just say, ""Goodnight"" (La-la-la, la-la-la) And we cuddle, sure I do love it But I need your lips on mine  [Chorus: Doja Cat] Can you kiss me more? We're so young, boy, we ain't got nothin' to lose, uh-oh It's just principle Baby, hold me 'cause I like the way you groove, uh-oh  [Post-Chorus: Doja Cat] Boy, you write your name, I can do the same Oh, I love the taste, la-la-la, la-la All on my tongue, I want it (La-la-la, la-la) Boy, you write your name, I can do the same Oh, I love the taste, la-la-la, la-la All on my tongue, I want it (La-la-la, la-la)  [Verse 1: Doja Cat] I, I feel like fucking something But we can be corny, fuck it Sugar, I ain't no dummy-dummy I likе to say, ""What if?"", but if We could kiss and just cut the rubbish Then I might bе on to somethin' I ain't givin' you one in public I'm givin' you hundreds, fuck it Somethin' we just gotta get into Sign first, middle, last, on the wisdom tooth Niggas wishin' that the pussy was a kissin' booth Taste breakfast, lunch and gin and juice And that dinner just like dessert too And when we French, refresh gimme two When I bite that lip, come get me too He want lipstick, lip-gloss, hickeys too, huh  [Chorus: Doja Cat] Can you kiss me more? We're so young, boy, we ain't got nothin' to lose, uh-oh It's just principle Baby, hold me 'cause I like the way you groove, uh-oh  [Post-Chorus: Doja Cat] Boy, you write your name, I can do the same Oh, I love the taste, la-la-la, la-la All on my tongue, I want it (La-la-la, la-la) Boy, you write your name, I can do the same Oh, I love the taste, la-la-la, la-la All on my tongue, I want it (La-la-la, la-la)  [Verse 2: SZA] Say give me a buck, need that Gucci stuff Push your limit, no, you ain't good enough All your niggas say that you lost without me All my bitches feel like I dodged it, don't need Fuckin' with you feel like jail, nigga I can't even exhale, nigga Pussy like holy grail, you know that You gon' make me need bail, you know that Caught creepin' with your friend You ain't even half man lyin' on your—, you know that Got me a bag for the break, you know that Control don't slow the pace, if I pull back All this ass for real (Ahh) Drama make you feel (Ahh) Fantasy and whip appeal Is all I can give you  [Chorus: Doja Cat, SZA & Both] Can you kiss me more? We're so young, boy, we ain't got nothin' to lose, uh-oh It's just principle Baby, hold me 'cause I like the way you groove, uh-oh Oh darlin'  [Post-Chorus: Doja Cat & SZA] Boy, you write your name, I can do the same Ooh, I love the taste, oh-la-la-la-la-la All on my tongue, I want it Boy, you write your name, I can do the same Ooh, I love the taste, oh-la-la-la-la-la All on my tongue, I want it"
62,Me Too,Meghan Trainor,Who's that sexy thang I see over there That's me standin' in the mirror What's that icy thang hangin' 'round my neck That's gold show me some respect I thank God every day That I woke up feelin' this way And I can't help lovin' myself And I don't need nobody else nuh If I was you I'd wanna be me too I'd wanna be me too I'd wanna be me too If I was you I'd wanna be me too I'd wanna be me too I'd wanna be me too I walk in like a dime piece I go straight to VIP I never pay for my drinks My entourage behind me My life's a movie Tom Cruise So bless me baby achoo And even if they tried to They can't do it like I do I thank God every day That I woke up feelin' this way And I can't help lovin' myself And I don't need nobody else nuh If I was you I'd wanna be me too I'd wanna be me too I'd wanna be me too If I was you I'd wanna be me too I'd wanna be me too I'd wanna be me too Turn the bass up Turn the bass up Turn the bass up Let's go I thank God every day That I woke up feelin' this way And I can't help lovin' myself And I don't need nobody else nuh If I was you I'd wanna be me too I'd wanna be me too I'd wanna be me too If I was you I'd wanna be me too I'd wanna be me too I'd wanna be me too If I was you I'd wanna be me too I'd wanna be me too I'd wanna be me too If I was you I'd wanna be me too I'd wanna be me too I'd wanna be me too
63,All I Want For Christmas Is You,New Hope Club,I don't want a lot for Christmas There is just one thing I need I don’t care about the presents Underneath the Christmas tree I just want you for my own More than you could ever know Make my wish come true All I want for Christmas is you You you you baby You you you baby I don't want a lot for Christmas There is just one thing I need Don't care about the presents Underneath the Christmas tree I don’t need to hang my stocking There upon the fireplace Santa Claus won't make me happy With a toy on Christmas Day I just want you for my own More than you could ever know Make my wish come true All I want for Christmas is you You you you baby You you you baby Oh I won't ask for much this Christmas I won't even wish for snow I'm just going to keep on waiting Underneath the mistletoe I won't make a list and send it To the North Pole for Saint Nick I won't even stay awake to Hear those magic reindeer click 'Cause I just want you here tonight Holding on to me so tight What more can I do Baby all I want for Christmas is you You you you baby You you you baby Oh all the lights are shining So brightly everywhere And the sound of children’s Laughter fills the air And everyone is singing I hear those sleigh bells ringing Santa won’t you bring me the one I really need Won't you please bring my baby to me Oh I don’t want a lot for Christmas This is all I'm asking for I just want to see my baby Standing right outside my door Oh I just want you for my own More than you could ever know Make my wish come true Baby all I want for Christmas is you You you you baby You baby You you you baby You baby
64,Holly Jolly Christmas,Michael Buble,have a holly jolly christmas  it’s the best time of the year  well i don’t know if there’ll be snow  but have a cup of cheer    have a holly jolly christmas  and when you walk down the street  say hello to friends you know  and everyone you meet    ho ho the mistletoe  is hung where you can see  somebody waits for you  kiss her once for me    have a holly jolly christmas  and in case you didn’t hear  oh by golly have a holly jolly christmas  this year    ho ho the mistletoe  is hung where you can see  somebody waits for you  kiss her once for me    have a holly jolly christmas  and in case you didn’t hear  oh by golly have a holly jolly christmas  this year
65,Painkiller,Ruel,You're my painkiller When my brain gets bitter You keep me close You keep me close I got front row seats for the park side livin' Feel like the one but I'm one in a billion Teenage cynical and I don't really know What's the point of living if my heart gets broken Driving on the road waiting for head-on collision Springtime funeral I miss you but I'd rather be alone To keep me from Heartbreaks headaches The doctor says I'm diagnosed with Shit days mistakes But I'll be fine Fine But I'll be fine 'Cause you're my painkiller When my brain gets bitter You keep me close When I've been miserable And it takes forever To let my brain get better You keep me close You keep me close Window seats as the plane starts leavin' Miss those streets where my knees were bleedin' Homesick veteran I left my bed again Oh looking for Heartbreaks headaches The doctor says I'm diagnosed with Shit days mistakes But I'll be fine But I'll be fine 'Cause you're my painkiller When my brain gets bitter You keep me close When I've been miserable And it takes forever To let my brain get better You keep me close You keep me close Please never leave me 'cause I'm barely holdin' on You give me a reason to keep on breathin' 'Cause you're my painkiller When my brain gets bitter You keep me close When I've been miserable And it takes forever To let my brain get better You keep me close ooh-woah You keep me close I know you hear me Close Yeah Close Close
66,Cozy Little Christmas,Katy Perry,Everybody's in a hurry in a flurry Shopping 'til they're droppin' in the snow Kids are cryin' dogs are barkin' Catching up with folks we barely know Sure it's madness but it's magic As soon as you hang up the mistletoe 'Cause you're the reason for the season No we don't need to keep up with the Jones Our love is something priceless I don't need diamonds no sparkly things No oh oh oh oh 'Cause you can't buy this a-feeling No oh oh oh oh Nothing lights my fire or wraps me up baby like you do Just want a cozy a cozy little Christmas here with you So Mr. Santa Mr. Santa Take the day off Take the day off Get a massage Get a massage 'Cause we've got this one all under control A little whiskey A little whiskey We're getting frisky Ooh And slow dancing to Nat King Cole No we ain't stressin' We ain't stressin' Just caressin' Mm-hmm Warming up our popsicle toes Nothing's missin' Nothing's missin' 'Cause you're a blessin' 'Cause you're the blessin' Yes you're the only one I'm wishing for Our love is something priceless I don't need diamonds no sparkly things No oh oh oh oh 'Cause you can't buy this a-feeling No oh oh oh oh Nothing lights my fire or wraps me up baby like you do Just want a cozy a cozy little Christmas here with you I don't need anything Take back all the Cartier and the Tiffany's and the Chanel Well can I keep that Chanel Please No no no no I don't need diamonds no sparkly things No oh oh oh oh 'Cause you can't buy this a-feeling No oh oh oh oh Nothing lights my fire or wraps me up baby like you do Just want a cozy a cozy little Christmas here with you Fa la la la la la la la la la la la la la la la la la Just you and me under a tree Fa la la la la la la la la la la la la la la la la la A cozy little Christmas here with you
67,Like 1999,Valley,Woke up it's 2021 I wanna get texts but I never wanna text back Fuck man I'm 2020 done Another paycheck and I blew it but I'm still sad We talk all of the time But it still feels like I'm just a voice on the line so If you wanna come over watch Friends and then get high Use my phone as a coaster we'll travel back in time Lights on the ceiling we're more than a feeling If you wanna come over act like it's 1999 Woke up had a dream about You We were parked in a Pontiac making out no internet Ten things I hate about you honestly nothing We talk all of the time and I love it So what are you doing tonight If you wanna come over watch Friends and then get high Use my phone as a coaster we'll travel back in time Lights on the ceiling we're more than a feeling If you wanna come over act like it's 1999-9-9-9 One sec' Do you mind if I'm nostalgic Let's go back before 2000 Back before our love was so distracted I wish that Y2K had happened we would stay forever classic You and I both be trapped in in 1999 We talk all of the time and I love it So what are you doing tonight If you wanna come over watch Friends and then get high Use my phone as a coaster we'll travel back in time Lights on the ceiling we're more than a feeling If you wanna come over act like it's 1999 If you wanna come over act like it's 1999
68,Have Yourself A Merry Little Christmas,Sam Smith,Have yourself a merry little Christmas Let your heart be light From now on your troubles will be out of sight yeah Have yourself a merry little Christmas Make the Yuletide gay From now on your troubles will be miles away oh Here we are as in olden days Happy golden days of yore ah Faithful friends who are dear to us They gather near to us once more ooh Through the years we all will be together and If the fates allow Hang a shining star upon the highest bough oh yeah oh And have yourself a merry little Christmas have yourself a merry little Christmas have yourself a merry little Christmas
69,Ashes,Stellar,Now that I got a taste I think that I'd suffocate For every second that you aren't by my side But now I'm stuck at the gate Of Lucifer's estate I fell in love with a girl I met in hell Thinkin' about all the things The way you pull my strings I love the way you turn me on I ain't Hades but I'm the King I'd do anything So that I could take you home She drove me drove me crazy a-yeah-ah She drove me drove me crazy a-yeah-ah She drove me drove me crazy a-yeah-ah She drove me drove me crazy a-yeah-ah Ring around the Rosie Pocket full of posie I'ma fucking blow all the ashes down Ring around the Rosie Pocket full of posie Imma fucking go crazy for ya now Ring around the Rosie Pocket full of posie I'ma fucking blow all the ashes down Ring around the Rosie Pocket full of posie I'ma fucking go crazy for ya now Now that I got a taste I'm gonna hallucinate I think that I am trippin' off your love I started playing your games You got me in a checkmate Now you are the queen and I'm the pawn Thinking about all the things The way you pull my strings I love the way you turn me on You're the Queen so let me be ya King I'd do anything So that we could rule the world She drove me drove me crazy a-yeah-ah She drove me drove me crazy a-yeah-ah She drove me drove me crazy a-yeah-ah She drove me drove me crazy a-yeah-ah Ring around the Rosie Pocket full of posie Imma fucking blow all the ashes down Ring around the Rosie Pocket full of posie I'ma fucking go crazy for ya now Ring around the Rosie Pocket full of posie Imma fucking blow all the ashes down Ring around the rosie Pocket full of posie Imma fucking go crazy for ya now Go crazy for ya now Blow all the ashes down
70,I'm Not The Only One,Sam Smith,You and me we made a vow For better or for worse I can't believe you let me down But the proof is in the way it hurts For months on end I've had my doubts Denying every tear I wish this would be over now But I know that I still need you here You say I'm crazy Cause you don't think I know what you've done But when you call me baby I know I'm not the only one You've been so unfaithful Now sadly I know why Your heart is unobtainable Even though lord knows you have mine You say I'm crazy Cause you don't think I know what you've done But when you call me baby I know I'm not the only one I have loved you for many years Maybe I am just not enough You've made me realise my deepest fear By lying and tearing us up You say I'm crazy Cause you don't think I know what you've done But when you call me baby I know I'm not the only one You say I'm crazy Cause you don't think I know what you've done But when you call me baby I know I'm not the only one I know I'm not the only one I know I'm not the only one And I know I know I'm not the only one
71,Warm on a Christmas Night,HONNE,Like a reindeer in headlights They're stunned by all your charm And I feel so damn lucky To have you on my arm Oh and I can't help but wonder Just how we ended up alright And I love you like no other This has never felt so right Oh you can keep me warm on a cold night Warm on a Christmas night Yeah you can keep me warm on a cold night Warm on a Christmas night I wanna treat you something special Give you what you deserve I wanna take you to paradise In a 1950s Merc Oh and I can't help but wonder Just how we ended up alright And I love you like no other But this has never felt so right You can keep me warm on a cold night Warm on a Christmas night Yeah you can keep me warm on a cold night Warm on a Christmas night Oh yeah you can keep me warm You can keep me real warm There's just one thing Girl you could have anyone So why you choosing me and not leaving me on my own Girl you could be with anyone So thanks for making me your number one You can keep me warm on a cold night Warm on a Christmas night Yeah you can keep me warm on a cold night Warm on a Christmas night Yeah wrap me up and keep me warm on a cold night Warm on a Christmas night Oh yeah you can keep me warm on a cold night Warm on a Christmas night Merry Christmas everybody
72,Sugar,Maroon 5,I'm hurting baby I'm broken down I need your loving loving I need it now When I'm without you I'm something weak You got me begging begging I'm on my knees I don't wanna be needing your love I just wanna be deep in your love And it's killing me when you're away Ooh baby cause a bullet don't care where you are I just wanna be there where you are And I gotta get one little taste Sugar Yes please Won't you come and put it down on me Oh right here cause I need Little love and little sympathy Yeah you show me good loving Make it alright Need a little a sweetness in my life Sugar Yes please Won't you come and put it down on me My broken pieces You put them up Don't leave me hanging hanging Come get me some When I'm without ya I'm so insecure You are the one thing one thing I'm living for I don't wanna be needing your love I just wanna be deep in your love And it's killing me when you're away Ooh baby cause a bullet don't care where you are I just wanna be there where you are And I gotta get one little taste Sugar Yes please Won't you come and put it down on me Oh right here cause I need Little love and little sympathy Yeah you show me good loving Make it alright Need a little a sweetness in my life Sugar Yes please Won't you come and put it down on me Yeah I want that red velvet I want that sugar sweet Don't let nobody touch it Unless that somebody is me I gotta be a man There ain't no other way Cause girl you're hotter than southern california bae I don't wanna play no games I don't gotta be afraid Don't give all that shy shit No make up on That's my Sugar Yes please Won't you come and put it down on me Oh right here cause I need Little love and little sympathy Yeah you show me good loving Make it alright Need a little a sweetness in my life Sugar Yes please Won't you come and put it down on me Sugar Yes please Won't you come and put it down on me Oh right here cause I need Little love and little sympathy Yeah you show me good loving Make it alright Need a little a sweetness in my life Sugar Yes please Won't you come and put it down on me
73,One Call Away,Charlie Puth,I'm only one call away I'll be there to save the day Superman got nothing on me I'm only one call away Call me baby if you need a friend I just wanna give you love C'mon c'mon c'mon Reaching out to you so take a chance No matter where you go You know you're not alone I'm only one call away I'll be there to save the day Superman got nothing on me I'm only one call away Come along with me and don't be scared I just wanna set you free C'mon c'mon c'mon You and me can make it anywhere For now we can stay here for a while Cause you know I just wanna see you smile No matter where you go You know you're not alone I'm only one call away I'll be there to save the day Superman got nothing on me I'm only one call away And when you're weak I'll be strong I'm gonna keep holding on Now don't you worry it won't be long Darling and when you feel like hope is gone Just run into my arms I'm only one call away I'll be there to save the day Superman got nothing on me I'm only one I'm only one call away I'll be there to save the day Superman got nothing on me I'm only one call away I'm only one call away
74,comethru,Jeremy Zucker,I might lose my mind Waking when the sun's down Riding all these highs Waiting for the comedown Walk these streets with me I'm doing decently Just glad that I can breathe yeah I'm trying to realize It's alright to not be fine On your own Now I'm shaking drinking all this coffee These last few weeks have been exhausting I'm lost in my imagination And there's one thing that I need from you Can you come through And there's one thing that I need from you Can you come through Ain't got much to do Too old for my hometown Went to bed at noon Couldn't put my phone down Scrolling patiently It's all the same to me Just faces on a screen yeah I'm trying to realize It's alright to not be fine On your own Now I'm shaking drinking all this coffee These last few weeks have been exhausting I'm lost in my imagination And there's one thing that I need from you Can you come through And there's one thing that I need from you Can you come through And there's one thing that I need from you Can you come through
